{
  "$schema": "https://json-schema.org/draft/2020-12/schema",
  "type": "object",
  "required": [
    "id", "version", "status", "calibration_required",
    "portfolio_volatility_limit", "correlation_window_trading_days", "stress_correlation",
    "volatility_drift_highlight_multiplier", "volatility_drift_strong_multiplier",
    "position_weight_min", "position_weight_max", "weight_tier_ladder",
    "near_event_trading_days",
    "refill_batch_ratio", "refill_batch2_clear_trading_days", "refill_deadline_trading_days",
    "exit_repurchase_restriction_days", "calm_period_trading_days"
  ],
  "properties": {
    "id": {"type": "string"}, "version": {"type": "string"}, "status": {"enum": ["draft", "active", "retired"]},
    "calibration_required": {"type": "boolean"},

    "portfolio_volatility_limit": {"type": "number", "exclusiveMinimum": 0,
      "description": "唯一硬卡口 σₚ 上限；估计器可降级，卡口值不变（STRATEGY 2.1）"},
    "correlation_window_trading_days": {"type": "integer", "minimum": 1,
      "description": "ρ 样本相关系数估计窗口（STRATEGY 2.1）"},
    "stress_correlation": {"type": "number", "minimum": 0, "maximum": 1,
      "description": "stress σₚ 令所有非对角 ρ 取此值重算；仅呈现，不触发交易（STRATEGY 2.1）"},

    "volatility_drift_highlight_multiplier": {"type": "number", "minimum": 1,
      "description": "σᵢ/σᵢ⁰ 高亮线，提示复核权重档位与证伪条件（STRATEGY 2.2）"},
    "volatility_drift_strong_multiplier": {"type": "number", "minimum": 1,
      "description": "σᵢ/σᵢ⁰ 强高亮线，进入待办并须书面记录复核结论（STRATEGY 2.2）"},
    "risk_capital_ratio_highlight_multiplier": {"type": "number", "minimum": 1,
      "description": "RCᵢ/wᵢ 风险密度高亮线；仅提示（STRATEGY 2.3）"},

    "position_weight_min": {"type": "number", "minimum": 0, "maximum": 1,
      "description": "单标的权重区间下界；构建规则而非风险卡口（STRATEGY 1.5）"},
    "position_weight_max": {"type": "number", "minimum": 0, "maximum": 1,
      "description": "单标的权重区间上界；构建规则而非风险卡口（STRATEGY 1.5）"},
    "weight_tier_ladder": {
      "type": "array", "minItems": 1, "uniqueItems": true,
      "items": {"type": "number", "exclusiveMinimum": 0, "maximum": 1},
      "description": "权重档位阶梯，均为 5% 的倍数以保证总能配平至 100%（STRATEGY 1.6）"
    },

    "near_event_trading_days": {"type": "integer", "minimum": 1,
      "description": "事件视界近区窗口；进入近区无预案即红旗（STRATEGY 3.1）"},

    "refill_batch_ratio": {
      "type": "array", "minItems": 1, "items": {"type": "number", "exclusiveMinimum": 0},
      "description": "风控减仓后的回补分批比例，按总和归一化（STRATEGY 3.3.1）"
    },
    "refill_batch2_clear_trading_days": {"type": "integer", "minimum": 1,
      "description": "第二批回补所需的卡口连续通过交易日数（STRATEGY 3.3.1）"},
    "refill_deadline_trading_days": {"type": "integer", "minimum": 1,
      "description": "回补强制时限：卡口连续通过此天数后剩余部分必须执行完毕（STRATEGY 3.3.1）"},

    "exit_repurchase_restriction_days": {"type": "integer", "minimum": 0,
      "description": "主动清仓后的禁回购天数；风控减仓不适用（STRATEGY 1.3 / 3.3.1）"},
    "calm_period_trading_days": {"type": "integer", "minimum": 0,
      "description": "平静期定义：距最近卡口触发的交易日数，参数修订的前置条件（STRATEGY 禁止事项 1）"}
  },
  "additionalProperties": false
}
